{
  "$schema": "../../schemas/workflow.schema.json",
  "id": "review-and-audit",
  "name": "Review and audit",
  "description": "Perform a bounded correctness, security, and architecture review with prioritized findings and explicit limitations.",
  "initialState": "resolve-scope",
  "states": [
    {
      "id": "resolve-scope",
      "description": "Resolve the review target, authority, depth, exclusions, and acceptance criteria.",
      "stopCondition": "Stop when review scope or authority remains ambiguous.",
      "durableOutput": ".aaa/state/workflows/{workflowId}.json"
    },
    {
      "id": "gather-evidence",
      "description": "Gather repository and, when authorized, primary external evidence relevant to the review scope.",
      "stopCondition": "Stop when required evidence is unavailable and the limitation cannot be bounded.",
      "durableOutput": ".aaa/state/workflows/{workflowId}.json"
    },
    {
      "id": "correctness-security-architecture-review",
      "description": "Review correctness, security, and architecture at the agreed public seams.",
      "stopCondition": "Stop when the evidence is insufficient for a defensible finding.",
      "durableOutput": ".aaa/state/workflows/{workflowId}.json"
    },
    {
      "id": "prioritized-findings",
      "description": "Rank findings by impact, likelihood, confidence, and remediation urgency with file and line evidence.",
      "stopCondition": "Stop when a finding cannot be tied to evidence or a clear disposition.",
      "durableOutput": ".aaa/state/workflows/{workflowId}.json"
    },
    {
      "id": "explicit-not-run",
      "description": "Report checks that were not run, why they were unavailable, and the exact later command or owner needed.",
      "terminal": true,
      "stopCondition": "Stop successfully only when findings, evidence, limitations, and not-run checks are explicit.",
      "durableOutput": ".aaa/state/workflows/{workflowId}.json"
    }
  ],
  "transitions": [
    { "id": "scope-resolved", "from": "resolve-scope", "to": "gather-evidence", "on": "scope-resolved" },
    { "id": "evidence-gathered", "from": "gather-evidence", "to": "correctness-security-architecture-review", "on": "evidence-gathered" },
    { "id": "review-complete", "from": "correctness-security-architecture-review", "to": "prioritized-findings", "on": "review-complete" },
    { "id": "findings-prioritized", "from": "prioritized-findings", "to": "explicit-not-run", "on": "findings-prioritized" }
  ],
  "gates": [
    { "id": "review-scope", "state": "resolve-scope", "requirement": "The review scope and authority are explicit.", "onFailure": "resolve-scope" },
    { "id": "evidence-availability", "state": "gather-evidence", "requirement": "Repository and authorized external evidence are recorded with source boundaries.", "onFailure": "gather-evidence" },
    { "id": "review-coverage", "state": "correctness-security-architecture-review", "requirement": "Correctness, security, and architecture seams are considered.", "onFailure": "correctness-security-architecture-review" },
    { "id": "finding-evidence", "state": "prioritized-findings", "requirement": "Every finding has evidence, priority, confidence, and disposition.", "onFailure": "prioritized-findings" },
    { "id": "limitations-report", "state": "explicit-not-run", "requirement": "Unavailable checks are explicitly marked not run with a concrete follow-up.", "onFailure": "explicit-not-run" }
  ],
  "recovery": {
    "durableState": {
      "required": true,
      "path": ".aaa/state/workflows/{workflowId}.json",
      "writeOnEveryTransition": true,
      "writeBeforeCompaction": true,
      "fields": ["workflowId", "state", "revision", "evidence"],
      "revision": { "field": "revision", "positiveInteger": true }
    },
    "compaction": {
      "checkpointRequired": true,
      "conversationSummaryIsAuthoritative": false,
      "resumeSource": "durableState"
    },
    "resume": {
      "verifyFromDisk": true,
      "revalidateCurrentState": true,
      "rejectIfMissingOrInvalid": true
    }
  },
  "allowedRoles": [],
  "capabilities": ["workflow-state", "filesystem-read", "repository-read", "external-research", "schema-validation"],
  "successCriteria": [
    "Findings are evidence-backed, prioritized, and scoped to the request.",
    "Every unavailable check is reported as not run rather than implied to pass."
  ]
}
