{
  "$schema": "../../schemas/workflow.schema.json",
  "id": "improve-skill",
  "name": "Improve skill",
  "description": "Improve one canonical skill through controlled failure capture, adversarial evaluation, and cross-harness qualification.",
  "initialState": "baseline-control",
  "states": [
    {
      "id": "baseline-control",
      "description": "Capture the current skill and its control evaluation results without changing the candidate.",
      "stopCondition": "Stop when the control baseline is missing, non-repeatable, or not comparable.",
      "durableOutput": ".aaa/state/workflows/{workflowId}.json"
    },
    {
      "id": "failure-rationalization-capture",
      "description": "Capture concrete failures, pressure cases, and rationalizations that the skill should prevent.",
      "stopCondition": "Stop when a claimed failure cannot be reproduced or distinguished from unrelated behavior.",
      "durableOutput": ".aaa/state/workflows/{workflowId}.json"
    },
    {
      "id": "smallest-wording-resource-change",
      "description": "Apply the smallest wording or supporting-resource change that addresses the captured failure.",
      "stopCondition": "Stop before editing when the proposed change is not minimal, scoped, or attributable to the failure.",
      "durableOutput": ".aaa/state/workflows/{workflowId}.json"
    },
    {
      "id": "repeated-adversarial-evaluation",
      "description": "Run repeated adversarial control and candidate evaluations and compare deterministic evidence.",
      "stopCondition": "Stop when evaluation samples, inputs, or scoring are not comparable.",
      "durableOutput": ".aaa/state/workflows/{workflowId}.json"
    },
    {
      "id": "cross-harness-qualification",
      "description": "Qualify the changed skill across available harnesses and document unavailable surfaces as not run.",
      "terminal": true,
      "stopCondition": "Stop successfully only when the candidate improves or preserves the control with no unresolved critical regression.",
      "durableOutput": ".aaa/state/workflows/{workflowId}.json"
    }
  ],
  "transitions": [
    { "id": "control-captured", "from": "baseline-control", "to": "failure-rationalization-capture", "on": "control-captured" },
    { "id": "failure-captured", "from": "failure-rationalization-capture", "to": "smallest-wording-resource-change", "on": "skill-change-approved", "requiresApproval": true, "allowedRoles": [] },
    { "id": "candidate-changed", "from": "smallest-wording-resource-change", "to": "repeated-adversarial-evaluation", "on": "skill-change-written", "requiresApproval": true, "allowedRoles": [] },
    { "id": "evaluation-complete", "from": "repeated-adversarial-evaluation", "to": "cross-harness-qualification", "on": "evaluation-complete" }
  ],
  "gates": [
    { "id": "control-baseline", "state": "baseline-control", "requirement": "The control input, samples, and scores are durable and repeatable.", "onFailure": "baseline-control" },
    { "id": "failure-evidence", "state": "failure-rationalization-capture", "requirement": "Failure and rationalization cases are concrete and reproducible.", "onFailure": "failure-rationalization-capture" },
    { "id": "candidate-scope", "state": "smallest-wording-resource-change", "requirement": "Only the smallest attributable wording or resource change is made.", "onFailure": "smallest-wording-resource-change" },
    { "id": "adversarial-comparison", "state": "repeated-adversarial-evaluation", "requirement": "Repeated control and candidate evaluations use comparable inputs and scoring.", "onFailure": "repeated-adversarial-evaluation" },
    { "id": "cross-harness-evidence", "state": "cross-harness-qualification", "requirement": "Available harnesses qualify the candidate and unavailable ones are marked not run.", "onFailure": "cross-harness-qualification" }
  ],
  "recovery": {
    "durableState": {
      "required": true,
      "path": ".aaa/state/workflows/{workflowId}.json",
      "writeOnEveryTransition": true,
      "writeBeforeCompaction": true,
      "fields": ["workflowId", "state", "revision", "evidence"],
      "revision": { "field": "revision", "positiveInteger": true }
    },
    "compaction": {
      "checkpointRequired": true,
      "conversationSummaryIsAuthoritative": false,
      "resumeSource": "durableState"
    },
    "resume": {
      "verifyFromDisk": true,
      "revalidateCurrentState": true,
      "rejectIfMissingOrInvalid": true
    }
  },
  "allowedRoles": [],
  "capabilities": ["workflow-state", "filesystem-read", "filesystem-write", "repository-read", "repository-write", "isolated-write", "evaluation", "schema-validation"],
  "successCriteria": [
    "The candidate change is attributable to a captured failure and remains minimal.",
    "Repeated adversarial evidence shows no critical regression and records cross-harness limitations."
  ]
}
