{
  "$schema": "../../schemas/workflow.schema.json",
  "id": "release-qualification",
  "name": "Release qualification",
  "description": "Qualify a repository release through static checks, deterministic contracts, native integration, behavioral evaluation, and an evidence report.",
  "initialState": "static-validation",
  "states": [
    {
      "id": "static-validation",
      "description": "Parse and validate canonical sources, schemas, paths, models, permissions, and generated metadata.",
      "stopCondition": "Stop when any required static validation fails.",
      "durableOutput": ".aaa/state/workflows/{workflowId}.json"
    },
    {
      "id": "deterministic-contracts",
      "description": "Run deterministic contract, graph, containment, ownership, and idempotency tests against disposable roots.",
      "stopCondition": "Stop when a required deterministic contract is failing or flaky.",
      "durableOutput": ".aaa/state/workflows/{workflowId}.json"
    },
    {
      "id": "native-integration",
      "description": "Run available native integration checks on clean disposable profiles and document unavailable products or platforms.",
      "stopCondition": "Stop when a required available native integration check fails; mark unavailable checks not run.",
      "durableOutput": ".aaa/state/workflows/{workflowId}.json"
    },
    {
      "id": "repeated-behavioral-evaluation",
      "description": "Run repeated fresh-context behavioral evaluations with fixed cases, controls, and scoring.",
      "stopCondition": "Stop when behavioral samples are not reproducible, comparable, or within the approved gate.",
      "durableOutput": ".aaa/state/workflows/{workflowId}.json"
    },
    {
      "id": "evidence-limitation-report",
      "description": "Write the release evidence, limitations, not-run checks, findings, and qualification decision.",
      "terminal": true,
      "stopCondition": "Stop successfully only when the qualification decision is supported by evidence and limitations are explicit.",
      "durableOutput": ".aaa/state/workflows/{workflowId}.json"
    }
  ],
  "transitions": [
    { "id": "static-pass", "from": "static-validation", "to": "deterministic-contracts", "on": "static-validation-pass" },
    { "id": "contracts-pass", "from": "deterministic-contracts", "to": "native-integration", "on": "deterministic-contracts-pass" },
    { "id": "native-evidence", "from": "native-integration", "to": "repeated-behavioral-evaluation", "on": "native-integration-complete" },
    { "id": "behavioral-evidence", "from": "repeated-behavioral-evaluation", "to": "evidence-limitation-report", "on": "report-written", "requiresApproval": true, "allowedRoles": [] }
  ],
  "gates": [
    { "id": "static-gate", "state": "static-validation", "requirement": "All required static sources and schemas validate.", "onFailure": "static-validation" },
    { "id": "deterministic-gate", "state": "deterministic-contracts", "requirement": "Required deterministic contracts pass without flakiness.", "onFailure": "deterministic-contracts" },
    { "id": "native-gate", "state": "native-integration", "requirement": "Available native checks pass and unavailable checks are explicit not run.", "onFailure": "native-integration" },
    { "id": "behavioral-gate", "state": "repeated-behavioral-evaluation", "requirement": "Repeated behavioral evidence meets the approved release thresholds.", "onFailure": "repeated-behavioral-evaluation" },
    { "id": "evidence-report-gate", "state": "evidence-limitation-report", "requirement": "Evidence, limitations, findings, and the decision are durable.", "onFailure": "evidence-limitation-report" }
  ],
  "recovery": {
    "durableState": {
      "required": true,
      "path": ".aaa/state/workflows/{workflowId}.json",
      "writeOnEveryTransition": true,
      "writeBeforeCompaction": true,
      "fields": ["workflowId", "state", "revision", "evidence"]
    },
    "compaction": {
      "checkpointRequired": true,
      "conversationSummaryIsAuthoritative": false,
      "resumeSource": "durableState"
    },
    "resume": {
      "verifyFromDisk": true,
      "revalidateCurrentState": true,
      "rejectIfMissingOrInvalid": true
    }
  },
  "allowedRoles": [],
  "capabilities": ["workflow-state", "filesystem-read", "filesystem-write", "repository-read", "repository-write", "test-execution", "evaluation", "native-rendering", "schema-validation"],
  "successCriteria": [
    "Static, deterministic, native, and behavioral gates have recorded evidence.",
    "The release decision states every limitation and not-run check without fabricated qualification."
  ]
}
