{
  "$schema": "../../schemas/workflow.schema.json",
  "id": "implement-change",
  "name": "Implement change",
  "description": "Implement an approved plan with test-first evidence, scoped writes, review, and verification.",
  "initialState": "approved-plan",
  "states": [
    {
      "id": "approved-plan",
      "description": "Load the approved plan, confirm ownership and scope, and record the implementation boundary.",
      "stopCondition": "Stop before tests when the plan is absent, stale, or not explicitly approved.",
      "durableOutput": ".aaa/state/workflows/{workflowId}.json"
    },
    {
      "id": "red-test",
      "description": "Write the smallest test at the public seam and observe the intended missing-behavior failure.",
      "stopCondition": "Stop when the test does not fail for the intended missing behavior.",
      "durableOutput": ".aaa/state/workflows/{workflowId}.json"
    },
    {
      "id": "scoped-implementation",
      "description": "Make the smallest authorized implementation change within the declared ownership boundary.",
      "stopCondition": "Stop before writing when ownership, containment, or authorization is not verified.",
      "durableOutput": ".aaa/state/workflows/{workflowId}.json"
    },
    {
      "id": "green-refactor",
      "description": "Run the focused test to GREEN, then refactor only while preserving the passing behavior.",
      "stopCondition": "Stop at the smallest failing implementation state when focused tests are not GREEN.",
      "durableOutput": ".aaa/state/workflows/{workflowId}.json"
    },
    {
      "id": "self-review",
      "description": "Review correctness, scope, error paths, security, determinism, and cross-platform behavior.",
      "stopCondition": "Stop before independent review until self-review findings are resolved or dispositioned.",
      "durableOutput": ".aaa/state/workflows/{workflowId}.json"
    },
    {
      "id": "independent-review",
      "description": "Obtain an independent review of behavior, authorization, and the exact diff.",
      "stopCondition": "Stop before verification while a Critical or High review finding remains unresolved.",
      "durableOutput": ".aaa/state/workflows/{workflowId}.json"
    },
    {
      "id": "verification",
      "description": "Run focused and full checks, inspect the final files, and record unavailable checks as not run.",
      "terminal": true,
      "stopCondition": "Stop successfully only with passing required checks and explicit evidence for every not-run check.",
      "durableOutput": ".aaa/state/workflows/{workflowId}.json"
    }
  ],
  "transitions": [
    { "id": "plan-loaded", "from": "approved-plan", "to": "red-test", "on": "plan-loaded" },
    { "id": "red-observed", "from": "red-test", "to": "scoped-implementation", "on": "implementation-scope-approved", "requiresApproval": true, "allowedRoles": [] },
    { "id": "implementation-written", "from": "scoped-implementation", "to": "green-refactor", "on": "implementation-written", "requiresApproval": true, "allowedRoles": [] },
    { "id": "green-observed", "from": "green-refactor", "to": "self-review", "on": "green-and-refactored" },
    { "id": "self-review-complete", "from": "self-review", "to": "independent-review", "on": "self-review-complete" },
    { "id": "independent-review-complete", "from": "independent-review", "to": "verification", "on": "independent-review-complete" }
  ],
  "gates": [
    { "id": "approved-plan", "state": "approved-plan", "requirement": "The current plan is explicitly approved and its files are owned.", "onFailure": "approved-plan" },
    { "id": "red-evidence", "state": "red-test", "requirement": "The focused test fails for the intended missing behavior.", "onFailure": "red-test" },
    { "id": "write-boundary", "state": "scoped-implementation", "requirement": "The destination is contained, owned, and within the authorized scope.", "onFailure": "scoped-implementation" },
    { "id": "green-evidence", "state": "green-refactor", "requirement": "Focused tests pass before and after any refactor.", "onFailure": "green-refactor" },
    { "id": "self-review-evidence", "state": "self-review", "requirement": "Self-review covers security, scope, determinism, and error paths.", "onFailure": "self-review" },
    { "id": "independent-review-evidence", "state": "independent-review", "requirement": "Independent review has no unresolved Critical or High finding.", "onFailure": "independent-review" },
    { "id": "verification-evidence", "state": "verification", "requirement": "Focused and full checks have recorded exit status and limitations.", "onFailure": "verification" }
  ],
  "recovery": {
    "durableState": {
      "required": true,
      "path": ".aaa/state/workflows/{workflowId}.json",
      "writeOnEveryTransition": true,
      "writeBeforeCompaction": true,
      "fields": ["workflowId", "state", "revision", "evidence"],
      "revision": { "field": "revision", "positiveInteger": true }
    },
    "compaction": {
      "checkpointRequired": true,
      "conversationSummaryIsAuthoritative": false,
      "resumeSource": "durableState"
    },
    "resume": {
      "verifyFromDisk": true,
      "revalidateCurrentState": true,
      "rejectIfMissingOrInvalid": true
    }
  },
  "allowedRoles": [],
  "capabilities": ["workflow-state", "filesystem-read", "filesystem-write", "repository-read", "repository-write", "isolated-write", "test-execution", "schema-validation"],
  "successCriteria": [
    "The approved change passes RED, GREEN, review, and verification gates.",
    "Only owned and authorized files changed, with exact evidence recorded."
  ]
}
