{
  "$schema": "../../schemas/workflow.schema.json",
  "id": "design-change",
  "name": "Design change",
  "description": "Turn an authorized change request into an approved, reviewed, and actionable plan.",
  "initialState": "discover-context",
  "states": [
    {
      "id": "discover-context",
      "description": "Read the repository instructions, current task, relevant source, and available external evidence.",
      "durableOutput": ".aaa/state/workflows/{workflowId}.json"
    },
    {
      "id": "clarify",
      "description": "Resolve the requested outcome, scope, constraints, authority, and open questions.",
      "stopCondition": "Stop when authority or scope cannot be resolved without a focused user decision.",
      "durableOutput": ".aaa/state/workflows/{workflowId}.json"
    },
    {
      "id": "compare-approaches",
      "description": "Compare at least two plausible approaches against correctness, safety, scope, and maintenance constraints.",
      "stopCondition": "Stop when the available evidence cannot distinguish a safe approach.",
      "durableOutput": ".aaa/state/workflows/{workflowId}.json"
    },
    {
      "id": "approve-design",
      "description": "Present the selected approach and obtain explicit approval before writing the specification.",
      "stopCondition": "Stop before specification changes when design approval is missing or withdrawn.",
      "durableOutput": ".aaa/state/workflows/{workflowId}.json"
    },
    {
      "id": "write-review-spec",
      "description": "Write the smallest durable specification and review it against the approved scope and evidence.",
      "stopCondition": "Stop before planning when the specification is not consistent with the approved design.",
      "durableOutput": ".aaa/state/workflows/{workflowId}.json"
    },
    {
      "id": "plan",
      "description": "Produce an executable plan with owned files, tests, gates, recovery, and verification evidence.",
      "terminal": true,
      "stopCondition": "Stop successfully only when the approved specification has a bounded implementation plan.",
      "durableOutput": ".aaa/state/workflows/{workflowId}.json"
    }
  ],
  "transitions": [
    { "id": "context-collected", "from": "discover-context", "to": "clarify", "on": "context-collected" },
    { "id": "scope-clarified", "from": "clarify", "to": "compare-approaches", "on": "scope-clarified" },
    { "id": "approaches-compared", "from": "compare-approaches", "to": "approve-design", "on": "approaches-compared" },
    { "id": "design-approved", "from": "approve-design", "to": "write-review-spec", "on": "design-approved", "requiresApproval": true, "allowedRoles": [] },
    { "id": "spec-reviewed", "from": "write-review-spec", "to": "plan", "on": "spec-written-and-reviewed", "requiresApproval": true, "allowedRoles": [] }
  ],
  "gates": [
    { "id": "context-evidence", "state": "discover-context", "requirement": "Repository instructions and relevant external evidence are recorded.", "onFailure": "discover-context" },
    { "id": "scope-authority", "state": "clarify", "requirement": "Scope, constraints, and authorization are explicit.", "onFailure": "clarify" },
    { "id": "approach-comparison", "state": "compare-approaches", "requirement": "Plausible approaches and their trade-offs are recorded.", "onFailure": "compare-approaches" },
    { "id": "design-approval", "state": "approve-design", "requirement": "The user explicitly approves the selected design.", "onFailure": "approve-design" },
    { "id": "specification-review", "state": "write-review-spec", "requirement": "The specification matches the approved design and remains bounded.", "onFailure": "write-review-spec" },
    { "id": "plan-ready", "state": "plan", "requirement": "The plan names scope, tests, gates, recovery, and verification evidence.", "onFailure": "plan" }
  ],
  "recovery": {
    "durableState": {
      "required": true,
      "path": ".aaa/state/workflows/{workflowId}.json",
      "writeOnEveryTransition": true,
      "writeBeforeCompaction": true,
      "fields": ["workflowId", "state", "revision", "evidence"],
      "revision": { "field": "revision", "positiveInteger": true }
    },
    "compaction": {
      "checkpointRequired": true,
      "conversationSummaryIsAuthoritative": false,
      "resumeSource": "durableState"
    },
    "resume": {
      "verifyFromDisk": true,
      "revalidateCurrentState": true,
      "rejectIfMissingOrInvalid": true
    }
  },
  "allowedRoles": [],
  "capabilities": ["workflow-state", "filesystem-read", "filesystem-write", "repository-read", "external-research", "schema-validation"],
  "successCriteria": [
    "The approved design and reviewed specification are durable.",
    "The plan is bounded, testable, and ready for implementation without skipping approval."
  ]
}
